{
  "metadata": {
    "schema_version": "2020-12",
    "schema_name": "groundwork-eval-score",
    "score_version": "v0.4.2",
    "suite": "trace-first-verify-review.csv",
    "case_id": "trace-ready-forbidden-behavior",
    "run_id": "sample",
    "evidence_sources": [
      "source_code"
    ]
  },
  "case_id": "trace-ready-forbidden-behavior",
  "suite": "trace-first-verify-review.csv",
  "expected_skill": "verify",
  "triggered_skill": "verify",
  "expected_execution_primitive": "not_applicable",
  "selected_execution_primitive": "not_applicable",
  "output_contract_verdict": "pass",
  "evidence_verdict": "pass",
  "behavior_verdict": "fail",
  "routing_verdict": "pass",
  "host_preemption_verdict": "not_applicable",
  "overall_verdict": "fail",
  "failure_type": "forbidden_behavior",
  "fix_locus": "behavior_contract",
  "checker_results": [
    {
      "checker_id": "trace_ready.forbidden_behavior",
      "verdict": "fail",
      "severity": "p2",
      "notes": [
        "Sample fixture covers current runner failure_type and fix_locus vocabulary."
      ],
      "fix_locus": "behavior_contract"
    }
  ],
  "score_subject": "verify",
  "notes": [
    "Schema-only sample; not runtime evidence."
  ]
}
